[{"course_num":"288","department":"ANTH 288/ LCD","approval_date":"9/14/06","text":"AII.5A.1         Anthropology (06-14, approved by Academic Senate 9/14/06)\nANTH 288/ LCD288. Voices of New York.\nJustification: To offer a course which combines analytical and research traditions from Anthropology and Linguistics which will focus on current language use and attitudes in New York and the U.S., and stress the development of skills in research design, analysis, and social scientific writing.  It will also add a U.S. area course to our curricula, which is focused on language issues.","justification":"To offer a course which combines analytical and research traditions from Anthropology and Linguistics which will focus on current language use and attitudes in New York and the U.S., and stress the development of skills in research design, analysis, and social scientific writing.  It will also add a U.S. area course to our curricula, which is focused on language issues.","id":"1","title":"Voices of New York","disp":"Anthropology"},{"course_num":"247","hours":"3","department":"ANTH","credits":"3","approval_date":"9/14/06","description":"Six credits in social science or sophomore standing.","prereq":"English 110","justification":"Archaeology of Europe.  The curricular contribution of this series consists of the application of anthropological concepts, methods and theories to the analysis change and stability of a specific cultural tradition.","text":"AII.5A.2         Anthropology (06-14, approved by Academic Senate 9/14/06)\nANTH 247.  Archaeology of Ireland.\n3 hr.: 3 cr.  Prereq.: English 110.  Six credits in social science or sophomore standing.\nPrereq.: English 110.  Six credits in social science or sophomore standing.\nSix credits in social science or sophomore standing.\nThe development of Irish society from the initial settlement by foraging peoples through the development of agriculture and metallurgy to the origins of chiefdoms and states.  Special attention is given to the Celtic Iron Age Society.\nJustification: Archaeology of Ireland has been taught twice under the Anthropology 290W listing (special topics).   The department  would like to establish the course as a regularly listed course. The course would be taught every other spring, alternating with the existing Anthropology 242W:  Archaeology of Europe.  The curricular contribution of this series consists of the application of anthropological concepts, methods and theories to the analysis change and stability of a specific cultural tradition.\nThe course is also part of the Irish Studies Program.  It is the only course dealing with Irish prehistory, and offers a bridge between the sagas and the historic period. This course will be proposed as a W course.","id":"2","title":"Archaeology of Ireland","disp":"Anthropology"},{"course_num":"299","hours":"3","department":"History","credits":"3","approval_date":"10/12/06","description":"A historical examination of how, and why, the United States became involved in Vietnam during the second half of the twentieth century.  Examines American foreign policy in Vietnam, the domestic impact of the war, movements against the war, and how race, class, and gender informed the composition of the armed forces, as well as larger questions related to issues such as nationalism, patriotism, dissent, and power.","justification":"The impact of the Vietnam War on American society and the place of the war in American foreign policy continue to be the subjects of historical research and debate.  It is important that students have an opportunity to explore the critical issues that the war raised. This course has been offered successfully as a History 200 Special Topics course.","text":"AII.5A.3         History (06-23, approved by Academic Senate 10/12/06)\nHistory 299: The Vietnam War and America.\n3 hours, 3 credits.\nA historical examination of how, and why, the United States became involved in Vietnam during the second half of the twentieth century.  Examines American foreign policy in Vietnam, the domestic impact of the war, movements against the war, and how race, class, and gender informed the composition of the armed forces, as well as larger questions related to issues such as nationalism, patriotism, dissent, and power.\nJustification:  The impact of the Vietnam War on American society and the place of the war in American foreign policy continue to be the subjects of historical research and debate.  It is important that students have an opportunity to explore the critical issues that the war raised. This course has been offered successfully as a History 200 Special Topics course.","id":"3","title":"The Vietnam War and America","disp":"History"},{"course_num":"552","hours":"3","department":"GEOL","credits":"3","approval_date":"10/12/06","description":"®","prereq":"Open to pre-service graduate students and in-service secondary school teachers; not open to students who have completed GEOL 551","justification":"This course is intended for Secondary Education MS Ed and pre-service teachers specializing in Science and Technology.  Like its companion course (GEOL 551) designed for Elementary Education students, it uses the international GLOBE Program protocols to study the environment and integrate principles and practices from the physical sciences. During initial training in the GLOBE protocols and web-based database, students will use those protocols to design and conduct research projects that examine the local environment at their schools or on the Queens College campus. The second half of the course is devoted to group research projects in topics selected by the students in consultation with the instructor.","text":"AII.5B.1 Earth &amp; Environmental Sciences (G06-42, approved by Academic Senate 10/12/06)\nGEOL 552. GLOBE\n®\nProgram Environmental research.  3 hrs.; 3 cr. Prereq.: Open to pre-service graduate students and in-service secondary school teachers; not open to students who have completed GEOL 551.\nPrereq.: Open to pre-service graduate students and in-service secondary school teachers; not open to students who have completed GEOL 551.\nResearch into selected local environmental issues using GLOBE\n®\nProgram protocols for atmosphere, soil, hydrology, seasonal change, and land cover. Course includes GLOBE\n®\nProgram teacher certification. Includes 3 all-day field exercises.\nRationale: This course is intended for Secondary Education MS Ed and pre-service teachers specializing in Science and Technology.  Like its companion course (GEOL 551) designed for Elementary Education students, it uses the international GLOBE Program protocols to study the environment and integrate principles and practices from the physical sciences. During initial training in the GLOBE protocols and web-based database, students will use those protocols to design and conduct research projects that examine the local environment at their schools or on the Queens College campus. The second half of the course is devoted to group research projects in topics selected by the students in consultation with the instructor.\nParticipants in this course model what their own students will do; once certified as GLOBE teachers, participants will use the same techniques and protocols in their classes and enrichment activities, and join the schools and environmental centers of the NY metropolitan area GLOBE community.\nThis course complements a series of 500-level Geology courses for teachers and the recently initiated Advanced Graduate Certificate in Earth Science. It also furthers the aims of the College’s Partnership in the GLOBE Program, now in its fourth year of full operation. By June, 2005, this partnership (GLOBE NY Metro) will have trained nearly 700 teachers from 300 schools.\nIn order to certify participants as GLOBE teachers, the instructor of the course will be a certified GLOBE Teacher Trainer.\nAIII – 5A.1\nExchange Agreement with the Universita’ degli Studi di Catania, Italy\nRESOLVED:  That the Board of Trustees of The City University of New York (CUNY) authorize the President of Queens College to execute an international agreement on behalf of Queens College and the John D. Calandra Italian American Institute with the Universita’ degli Studi di Catania, to enable CUNY students enrolled in the CUNY/ITALY Exchange Program to study at the Universita’ degli Studi di Catania and the Universita’ degli Studi di Catania students to study at CUNY.  Neither party to this agreement is obligated to pay any monetary consideration to the other.  The agreement is for a one year period beginning in September 1, 2006 to August 31, 2007 and shall include up to two two-year options for the College to renew in its best interest.  The agreement shall be subject to approval as to form by the University Office of General Counsel.\nEXPLANATION:   This Agreement will allow an exchange of students from The City University of New York (CUNY) and the Universita’ degli Studi di Catania, in Italy.  The equivalent of two (2) students per institution per academic year are expected to participate.\nAIII – 5A.2\nExchange Agreement with the Universita’ per Stranieri di Perugia, Italy\nRESOLVED:  That the Board of Trustees of The City University of New York (CUNY) authorize the President of Queens College to execute an international agreement on behalf of Queens College and the John D. Calandra Italian American Institute with the Universita’ per Stranieri di Perugia, to enable CUNY students enrolled in the CUNY/ITALY Exchange Program to study at the Universita’ per Stranieri di Perugia and the Universita’ per Stranieri di Perugia students to study at CUNY.  Neither party to this agreement is obligated to pay any monetary consideration to the other.  The agreement is for a three year period beginning in July1, 2006 to June 30, 2009 and shall include up to two three-year options for the College to renew in its best interest.  The agreement shall be subject to approval as to form by the University Office of General Counsel.\nEXPLANATION:   This Agreement will allow an exchange of students from The City University of New York (CUNY) and the Universita’ per Stranieri di Perugia, in Italy.  The equivalent of five (5) students per institution per academic year are expected to participate.\nAIII – 5A.3\nExchange Agreement with the Universita’ degli Studi di Trento, Italy\nRESOLVED:  That the Board of Trustees of The City University of New York (CUNY) authorize the President of Queens College to execute an international agreement on behalf of Queens College and the John D. Calandra Italian American Institute with the Universita’ degli Studi di Trento, to enable CUNY students enrolled in the CUNY/ITALY Exchange Program to study at the Universita’ degli Studi di Trento and the Universita’ degli Studi di Trento students to study at CUNY.  Neither party to this agreement is obligated to pay any monetary consideration to the other.  The agreement is for a one year period beginning in September 1, 2006 to August 31, 2007 and shall include up to two two-year options for the College to renew in its best interest.  The agreement shall be subject to approval as to form by the University Office of General Counsel.\nEXPLANATION:   This Agreement will allow an exchange of students from The City University of New York (CUNY) and the Universita’ degli Studi di Trento, in Italy.  The equivalent of two (2) students per institution per academic year are expected to participate.\nAIII – 5A.4\nExchange Agreement with the Universita’ degli Studi di Pavia, Italy\nRESOLVED:  That the Board of Trustees of The City University of New York (CUNY) authorize the President of Queens College to execute an international agreement on behalf of Queens College and the John D. Calandra Italian American Institute with the Universita’ degli Studi di Pavia, to enable CUNY students enrolled in the CUNY/ITALY Exchange Program to study at the Universita’ degli Studi di Pavia, and the Universita’ degli Studi di Pavia students to study at CUNY.  Neither party to this agreement is obligated to pay any monetary consideration to the other.  The agreement is for a one year period beginning in September 1, 2006 to August 31, 2007 and shall include up to two two-year options for the College to renew in its best interest.  The agreement shall be subject to approval as to form by the University Office of General Counsel.\nEXPLANATION:   This Agreement will allow an exchange of students from The City University of New York (CUNY) and the Universita’ degli Studi di Pavia, in Italy.  The equivalent of two (2) students per institution per academic year are expected to participate.\nAIII – 5A.5\nExchange Agreement with the Universita’ degli Studi di Siena, Italy\nRESOLVED:  That the Board of Trustees of The City University of New York (CUNY) authorize the President of Queens College to execute an international agreement on behalf of Queens College and the John D. Calandra Italian American Institute with the Universita’ degli Studi di Siena, to enable CUNY students enrolled in the CUNY/ITALY Exchange Program to study at the Universita’ degli Studi di Siena and the Universita’ degli Studi di Siena students to study at CUNY.  Neither party to this agreement is obligated to pay any monetary consideration to the other.  The agreement is for a one year period beginning in September 1, 2006 to August 31, 2007 and shall include up to two two-year options for the College to renew in its best interest.  The agreement shall be subject to approval as to form by the University Office of General Counsel.\nEXPLANATION:   This Agreement will allow an exchange of students from The City University of New York (CUNY) and the Universita’ degli Studi di Siena, in Italy.  The equivalent of two (2) students per institution per academic year are expected to participate.\nAIII – 5A.6\nAgreement with Mercy Medical Center\nRESOLVED:  That the Board of Trustees of The City University of New York authorize the General Counsel to execute an affiliation agreement on behalf of Queens College with Mercy Medical Center to enable students enrolled in the College's exercise sciences  program in the Department of Family, Nutrition and Exercise Sciences to obtain the appropriate clinical experience necessary for the completion of degree requirements.  Neither party to this agreement is obligated to pay any monetary consideration to the other.  The agreement is for a two year period and shall include up to two two-year options for the College to renew in its best interest.  The agreement shall be subject to approval as to form by the University Office of General Counsel.\nEXPLANATION:   Student experience at Mercy Medical Center will fulfill the clinical training required for the exercise sciences program of the College’s Department of Family, Nutrition and Exercise Sciences.\nAIII – 5A.7\nAgreement with The League Treatment Center\nRESOLVED:  That the Board of Trustees of The City University of New York authorize the General Counsel to execute an affiliation agreement on behalf of Queens College with The League Treatment Center to enable students enrolled in the College's speech and hearing program in the Department of Linguistics and Communication Disorders to obtain the appropriate clinical experience necessary for the completion of degree requirements.  Neither party to this agreement is obligated to pay any monetary consideration to the other.  The agreement is for a two year period and shall include up to two two-year options for the College to renew in its best interest.  The agreement shall be subject to approval as to form by the University Office of General Counsel.\nEXPLANATION:   Student experience at The League Treatment Center will fulfill the clinical training required for the speech and hearing program of the College’s Department of Linguistics and Communication Disorders.\nAIII – 5A.8\nAgreement with Long Island Jewish Medical Center\nRESOLVED:  That the Board of Trustees of The City University of New York authorize the General Counsel to execute an affiliation agreement on behalf of Queens College with Long Island Jewish Medical Center to enable students enrolled in the College's speech and hearing program in the Department of Linguistics and Communication Disorders to obtain the appropriate clinical experience necessary for the completion of degree requirements.  Neither party to this agreement is obligated to pay any monetary consideration to the other.  The agreement is for a two year period and shall include up to two two-year options for the College to renew in its best interest.  The agreement shall be subject to approval as to form by the University Office of General Counsel.\nEXPLANATION:   Student experience at Long Island Jewish Medical Center will fulfill the clinical training required for the speech and hearing program of the College’s Department of Linguistics and Communication Disorders.\nAIII – 5A.9\nInternational Agreement with Universidad de Valladolid, Spain\nRESOLVED:  That the Board of Trustees of The City University of New York authorize the President of Queens College to execute an  international Study Abroad agreement on behalf of Queens College with Universidad de Valladolid, Spain, to enable students enrolled in the College’s Education Abroad program to study liberal arts courses including Spanish language, literature, culture, art and music.  Other than the transmission of student fees by the College to Universidad de Valladolid, neither party to this agreement is obligated to pay any monetary consideration to the other.  The agreement is for a one-year period and shall include up to two two-year options for the College to renew in its best interest.  This program will begin January 1, 2007.  The agreement shall be subject to approval as to form by the University Office of the General Counsel.\nEXPLANATION:  CUNY students in the Queens College Education Abroad program will be able to attend Universidad de Valladolid and take courses that are pre-approved by Queens College.  Approximately 60 CUNY students will participate in this program each academic year.\nAIII – 5A.10\nInternational Agreement with Rikkyo University, Tokyo, Japan\nRESOLVED:  That the Board of Trustees of The City University of New York authorize the President of Queens College to execute an  international Study Abroad agreement on behalf of Queens College with Rikkyo University, Tokyo, Japan, to enable CUNY students participating in the Queens College-Rikkyo University Exchange Program to pursue courses at Rikkyo University and Rikkyo University students to pursue courses at Queens College.  Other than the transmission of student fees by the College to Rikkyo University neither party to this agreement is obligated to pay any monetary consideration to the other.  The agreement is for a one-year period and shall include up to two two-year options for the College to renew in its best interest.  This program will begin January 1, 2007.  The agreement shall be subject to approval as to form by the University Office of the General Counsel.\nEXPLANATION:  CUNY students in the Queens College-Rikkyo University Exchange Program will be able to attend Rikkyo University, Tokyo, Japan, to take courses that are pre-approved by Queens College, and Rikkyo University students will be able to attend Queens College on a reciprocal tuition exchange basis.  Approximately 24 CUNY students and 6 Rikkyo students will participate in this program each academic year.\nAIII – 5A.11\nInternational Agreement with University of Indianapolis-Athens Campus, Greece\nRESOLVED:  That the Board of Trustees of The City University of New York authorize the President of Queens College to execute an  international Study Abroad agreement on behalf of Queens College with University of Indianapolis-Athens Campus, Athens, Greece, to enable students enrolled in the College’s Education Abroad program to study liberal arts courses including language, literature, civilization, culture, and art.  Other than the transmission of student fees by the College to University of Indianapolis-Athens Campus,  neither party to this agreement is obligated to pay any monetary consideration to the other.  The agreement is for a one-year period and shall include up to two two-year options for the College to renew in its best interest.  This program will begin December 28, 2006.  The agreement shall be subject to approval as to form by the University Office of the General Counsel.\nEXPLANATION:  CUNY students in the Queens College Education Abroad program will be able to attend University of Indianapolis-Athens Campus and take courses that are pre-approved by Queens College during summer and winter intersession.  Approximately 60 CUNY students will participate in this program each academic year.\nAIII – 5A.12\nAgreement with Peninsula Hospital Center\nRESOLVED:  That the Board of Trustees of The City University of New York authorize the General Counsel to execute an affiliation agreement on behalf of Queens College with Peninsula Hospital Center to enable students enrolled in the College's speech and hearing program in the Department of Linguistics and Communications Disorders to obtain the appropriate clinical experience necessary for the completion of degree requirements.  Neither party to this agreement is obligated to pay any monetary consideration to the other.  The agreement is for a two year period and shall include up to two two-year options for the College to renew in its best interest.  The agreement shall be subject to approval as to form by the University Office of General Counsel.\nEXPLANATION:   Student experience at Peninsula Hospital Center will fulfill the clinical training required for the speech and hearing program of the College’s Department of Linguistics and Communications Disorders.","id":"1","title":"GLOBE","disp":"Earth &amp; Environmental Sciences"}]